{
    "id": "15ECB9F3-C0F7-42CF-9CE3-C6DDED17DE83",
    "name": "DownloadCircleCIArtifacts",
    "friendlyName": "Download Artifacts - CircleCI",
    "description": "Download artifacts from CircleCI build",
    "helpMarkDown": "",
    "category": "Utility",
    "author": "Microsoft Corporation",
    "preview": true,
    "version": {
      "Major": 0,
      "Minor": 147,
      "Patch": 0
    },
    "demands": [],
    "inputs": [
      {
        "name": "connection",
        "type": "connectedService:circleci",
        "label": "CircleCI Connection",
        "defaultValue": "",
        "required": true,
        "helpMarkDown": "CircleCI connection"
      },
      {
        "name": "definition",
        "type": "pickList",
        "label": "Build Configuration",
        "defaultValue": "",
        "required": true,
        "properties": {
          "EditableOptions": "True"
        },
        "helpMarkDown": "Select the build configuration"
      },
      {
        "name": "version",
        "type": "pickList",
        "label": "Build",
        "defaultValue": "",
        "required": true,
        "properties": {
          "EditableOptions": "True"
        },
        "helpMarkDown": "Build Id"
      },
      {
        "name": "itemPattern",
        "type": "string",
        "label": "Item Pattern",
        "defaultValue": "**",
        "required": false,
        "helpMarkDown": "Minimatch pattern to filter files to be downloaded. To download all files within artifact drop use drop/**"
      },
      {
        "name": "downloadPath",
        "type": "string",
        "label": "Destination directory",
        "defaultValue": "$(System.ArtifactsDirectory)",
        "required": true,
        "helpMarkDown": "Path on the agent machine where the artifact will be downloaded"
      },
      {
        "name": "downloadCommitsAndWorkItems",
        "type": "boolean",
        "label": "Download Commits and WorkItems",
        "defaultValue": true,
        "required": false,
        "groupName": "advanced",
        "helpMarkDown": "Enables downloading the commits and workitem details associated with the CircleCI build"
      }
    ],
    "dataSourceBindings": [
      {
        "endpointId": "$(connection)",
        "target": "definition",
        "dataSourceName": "Projects",
        "resultTemplate": "{ \"Value\" : \"{{{vcs_type}}}/{{{username}}}/{{{reponame}}}\", \"DisplayValue\" : \"{{{vcs_type}}}/{{{username}}}/{{{reponame}}}\" }"
      },
      {
        "endpointId": "$(connection)",
        "target": "version",
        "dataSourceName": "Builds",
        "parameters": {
            "definition": "$(definition)"
        },
        "resultTemplate": "{ \"Value\" : \"{{{defaultResultKey}}}\", \"DisplayValue\" : \"{{{defaultResultKey}}}\" }"
      }
    ],
    "instanceNameFormat": "Download Artifacts - CircleCI V0",
    "execution": {
      "Node": {
        "target": "download.js",
        "argumentFormat": ""
      }
    },
    "messages": {
      "DownloadArtifacts": "Downloading artifacts from : %s",
      "GettingCommitsFromSingleBuild": "Downloading commits associated with the build %s",
      "ArtifactsSuccessfullyDownloaded": "Successfully downloaded artifacts to %s",
      "DownloadingCircleCICommitsBetween": "Downloading commits between builds %s to %s",
      "WritingCommitsTo": "Writing commits to file %s",
      "RetryingOperation": "Error: in %s, so retrying => retries pending  : %s",
      "CouldNotWriteToFile": "Could not save content to file. Failed with an error %s",
      "UploadingAttachment": "Uploading %s as attachment",
      "SuccessfullyUploadedCommitsAttachment": "Successfully uploaded commits attachment",
      "BranchNotFound": "Branch not found"
    }
  }
  