{
  "id": "EF087383-EE5E-42C7-9A53-AB56C98420F9",
  "name": "VSTest",
  "friendlyName": "ms-resource:loc.friendlyName",
  "description": "ms-resource:loc.description",
  "helpUrl": "https://docs.microsoft.com/azure/devops/pipelines/tasks/test/vstest",
  "helpMarkDown": "ms-resource:loc.helpMarkDown",
  "category": "Test",
  "visibility": [
    "Build",
    "Release"
  ],
  "runsOn": [
    "Agent",
    "DeploymentGroup"
  ],
  "author": "Microsoft Corporation",
  "version": {
    "Major": 1,
    "Minor": 281,
    "Patch": 0
  },
  "demands": [
    "vstest"
  ],
  "minimumAgentVersion": "1.89.0",
  "groups": [
    {
      "name": "executionOptions",
      "displayName": "ms-resource:loc.group.displayName.executionOptions",
      "isExpanded": true
    },
    {
      "name": "advancedExecutionOptions",
      "displayName": "ms-resource:loc.group.displayName.advancedExecutionOptions",
      "isExpanded": false
    },
    {
      "name": "reportingOptions",
      "displayName": "ms-resource:loc.group.displayName.reportingOptions",
      "isExpanded": false
    }
  ],
  "deprecated": true,
  "deprecationMessage": "The VSTest@1 task is deprecated, please use the latest version of the VSTest task",
  "inputs": [
    {
      "name": "testAssembly",
      "type": "string",
      "label": "ms-resource:loc.input.label.testAssembly",
      "defaultValue": "**\\*test*.dll;-:**\\obj\\**",
      "required": true,
      "helpMarkDown": "ms-resource:loc.input.help.testAssembly",
      "groupName": "executionOptions"
    },
    {
      "name": "testFiltercriteria",
      "type": "string",
      "label": "ms-resource:loc.input.label.testFiltercriteria",
      "defaultValue": "",
      "required": false,
      "helpMarkDown": "ms-resource:loc.input.help.testFiltercriteria",
      "groupName": "executionOptions"
    },
    {
      "name": "runSettingsFile",
      "type": "filePath",
      "label": "ms-resource:loc.input.label.runSettingsFile",
      "defaultValue": "",
      "required": false,
      "helpMarkDown": "ms-resource:loc.input.help.runSettingsFile",
      "groupName": "executionOptions"
    },
    {
      "name": "overrideTestrunParameters",
      "type": "string",
      "label": "ms-resource:loc.input.label.overrideTestrunParameters",
      "defaultValue": "",
      "required": false,
      "helpMarkDown": "ms-resource:loc.input.help.overrideTestrunParameters",
      "groupName": "executionOptions"
    },
    {
      "name": "codeCoverageEnabled",
      "type": "boolean",
      "label": "ms-resource:loc.input.label.codeCoverageEnabled",
      "defaultValue": "False",
      "required": false,
      "helpMarkDown": "ms-resource:loc.input.help.codeCoverageEnabled",
      "groupName": "executionOptions"
    },
    {
      "name": "runInParallel",
      "type": "boolean",
      "label": "ms-resource:loc.input.label.runInParallel",
      "defaultValue": "false",
      "required": false,
      "helpMarkDown": "ms-resource:loc.input.help.runInParallel",
      "groupName": "executionOptions"
    },
    {
      "name": "vstestLocationMethod",
      "type": "radio",
      "label": "ms-resource:loc.input.label.vstestLocationMethod",
      "required": false,
      "groupName": "advancedExecutionOptions",
      "defaultValue": "version",
      "options": {
        "version": "Version",
        "location": "Specify Location"
      }
    },
    {
      "name": "vsTestVersion",
      "type": "pickList",
      "label": "ms-resource:loc.input.label.vsTestVersion",
      "defaultValue": "14.0",
      "required": false,
      "helpMarkDown": "ms-resource:loc.input.help.vsTestVersion",
      "groupName": "advancedExecutionOptions",
      "visibleRule": "vstestLocationMethod = version",
      "options": {
        "latest": "Latest",
        "14.0": "Visual Studio 2015",
        "12.0": "Visual Studio 2013"
      }
    },
    {
      "name": "vstestLocation",
      "type": "string",
      "label": "ms-resource:loc.input.label.vstestLocation",
      "defaultValue": "",
      "required": false,
      "helpMarkDown": "ms-resource:loc.input.help.vstestLocation",
      "visibleRule": "vstestLocationMethod = location",
      "groupName": "advancedExecutionOptions"
    },
    {
      "name": "pathtoCustomTestAdapters",
      "type": "string",
      "label": "ms-resource:loc.input.label.pathtoCustomTestAdapters",
      "defaultValue": "",
      "required": false,
      "helpMarkDown": "ms-resource:loc.input.help.pathtoCustomTestAdapters",
      "groupName": "advancedExecutionOptions"
    },
    {
      "name": "otherConsoleOptions",
      "type": "string",
      "label": "ms-resource:loc.input.label.otherConsoleOptions",
      "defaultValue": "",
      "required": false,
      "helpMarkDown": "ms-resource:loc.input.help.otherConsoleOptions",
      "groupName": "advancedExecutionOptions"
    },
    {
      "name": "testRunTitle",
      "type": "string",
      "label": "ms-resource:loc.input.label.testRunTitle",
      "defaultValue": "",
      "required": false,
      "helpMarkDown": "ms-resource:loc.input.help.testRunTitle",
      "groupName": "reportingOptions"
    },
    {
      "name": "platform",
      "type": "string",
      "label": "ms-resource:loc.input.label.platform",
      "defaultValue": "",
      "required": false,
      "helpMarkDown": "ms-resource:loc.input.help.platform",
      "groupName": "reportingOptions"
    },
    {
      "name": "configuration",
      "type": "string",
      "label": "ms-resource:loc.input.label.configuration",
      "defaultValue": "",
      "required": false,
      "helpMarkDown": "ms-resource:loc.input.help.configuration",
      "groupName": "reportingOptions"
    },
    {
      "name": "publishRunAttachments",
      "type": "boolean",
      "label": "ms-resource:loc.input.label.publishRunAttachments",
      "defaultValue": "true",
      "required": false,
      "helpMarkDown": "ms-resource:loc.input.help.publishRunAttachments",
      "groupName": "reportingOptions"
    }
  ],
  "instanceNameFormat": "ms-resource:loc.instanceNameFormat",
  "execution": {
    "PowerShell": {
      "target": "$(currentDirectory)\\VSTest.ps1",
      "argumentFormat": "",
      "workingDirectory": "$(currentDirectory)",
      "platforms": [
        "windows"
      ]
    }
  },
  "messages": {
    "PathDoesNotExist": "ms-resource:loc.messages.PathDoesNotExist",
    "VstestReturnCode": "ms-resource:loc.messages.VstestReturnCode",
    "NoMatchingTestAssemblies": "ms-resource:loc.messages.NoMatchingTestAssemblies",
    "VstestNotFound": "ms-resource:loc.messages.VstestNotFound",
    "VstestFailed": "ms-resource:loc.messages.VstestFailed",
    "VstestTIANotSupported": "ms-resource:loc.messages.VstestTIANotSupported",
    "NoResultsToPublish": "ms-resource:loc.messages.NoResultsToPublish",
    "ErrorWhileReadingRunSettings": "ms-resource:loc.messages.ErrorWhileReadingRunSettings",
    "ErrorWhileReadingTestSettings": "ms-resource:loc.messages.ErrorWhileReadingTestSettings",
    "RunInParallelNotSupported": "ms-resource:loc.messages.RunInParallelNotSupported",
    "FailedToSetRunInParallel": "ms-resource:loc.messages.FailedToSetRunInParallel",
    "UpdateOneOrHigherRequired": "ms-resource:loc.messages.UpdateOneOrHigherRequired",
    "ErrorOccuredWhileSettingRegistry": "ms-resource:loc.messages.ErrorOccuredWhileSettingRegistry",
    "ErrorWhileSettingTestImpactCollectorTestSettings": "ms-resource:loc.messages.ErrorWhileSettingTestImpactCollectorTestSettings",
    "ErrorWhileSettingTestImpactCollectorRunSettings": "ms-resource:loc.messages.ErrorWhileSettingTestImpactCollectorRunSettings",
    "ErrorWhileCreatingResponseFile": "ms-resource:loc.messages.ErrorWhileCreatingResponseFile",
    "ErrorWhileUpdatingResponseFile": "ms-resource:loc.messages.ErrorWhileUpdatingResponseFile",
    "ErrorWhilePublishingCodeChanges": "ms-resource:loc.messages.ErrorWhilePublishingCodeChanges",
    "ErrorWhileListingDiscoveredTests": "ms-resource:loc.messages.ErrorWhileListingDiscoveredTests",
    "PublishCodeChangesPerfTime": "ms-resource:loc.messages.PublishCodeChangesPerfTime",
    "GenerateResponseFilePerfTime": "ms-resource:loc.messages.GenerateResponseFilePerfTime",
    "UploadTestResultsPerfTime": "ms-resource:loc.messages.UploadTestResultsPerfTime",
    "ErrorReadingVstestVersion": "ms-resource:loc.messages.ErrorReadingVstestVersion",
    "UnexpectedVersionString": "ms-resource:loc.messages.UnexpectedVersionString",
    "UnexpectedVersionNumber": "ms-resource:loc.messages.UnexpectedVersionNumber",
    "VstestDiagNotSupported": "ms-resource:loc.messages.VstestDiagNotSupported"
  }
}