{
    "id": "1E244D32-2DD4-4165-96FB-B7441CA9331E",
    "name": "AzureKeyVault",
    "friendlyName": "Azure Key Vault",
    "description": "Download Azure Key Vault Secrets",
    "helpMarkDown": "[More Information](https://aka.ms/azkvtaskreadme)",
    "category": "Deploy",
    "releaseNotes": "Works with Xplat agents (Windows, Linux or OSX)",
    "visibility": [
        "Build",
        "Release"
    ],
    "author": "Microsoft Corporation",
    "version": {
        "Major": 1,
        "Minor": 0,
        "Patch": 0
    },
    "demands": [],
    "minimumAgentVersion": "2.0.0",
    "inputs": [
        {
            "name": "ConnectedServiceName",
            "type": "connectedService:AzureRM",
            "label": "Azure subscription",
            "defaultValue": "",
            "required": true,
            "helpMarkDown": "Select the Azure subscription for the key vault."
        },
        {
            "name": "KeyVaultName",
            "type": "pickList",
            "label": "Key vault",
            "required": true,
            "helpMarkDown": "Provide the name of a key vault.",
            "properties": {
                "EditableOptions": "True"
            }
        },
        {
            "name": "SecretsFilter",
            "type": "string",
            "label": "Secrets filter",
            "defaultValue": "*",
            "required": true,
            "helpMarkDown": "Comma separated list of secret names or leave * to download all secrets from the selected key vault.",
            "options": {
                "EditableOptions": "True"
            }
        }
    ],
    "dataSourceBindings": [
        {
            "target": "KeyVaultName",
            "endpointId": "$(ConnectedServiceName)",
            "dataSourceName": "AzureKeyVaults"
        }
    ],
    "instanceNameFormat": "Azure Key Vault: $(KeyVaultName)",
    "execution": {
        "Node": {
            "target": "main.js"
        }
    },
    "messages": {
        "ClientIdCannotBeEmpty": "clientId must be a non empty string.",
        "DomainCannotBeEmpty": "domain must be a non empty string.",
        "SecretCannotBeEmpty": "secret must be a non empty string.",
        "armUrlCannotBeEmpty": "arm Url must be a non empty string.",
        "authorityUrlCannotBeEmpty": "authority must be a non empty string.",
        "CouldNotFetchAccessTokenforAzureStatusCode": "Could not fetch access token for azure. Status code: %s, status message: %s",
        "CallbackCannotBeNull": "callback cannot be null.",
        "CredentialsCannotBeNull": "'credentials' cannot be null.",
        "SubscriptionIdCannotBeNull": "'subscriptionId' cannot be null.",
        "InvalidResponseLongRunningOperation": "Invalid response received for fetching status of a long running operation.",
        "TimeoutWhileWaiting": "Timed out while waiting",
        "ResourceGroupCannotBeNull": "resourceGroupName cannot be null or undefined and it must be of type string.",
        "ResourceGroupExceededLength": "\"resourceGroupName\" should satisfy the constraint - \"MaxLength\": 90",
        "ResourceGroupDeceededLength": "\"resourceGroupName\" should satisfy the constraint - \"MinLength\": 1",
        "ResourceGroupDoesntMatchPattern": "\"resourceGroupName\" should satisfy the constraint - \"Pattern\": /^[-\\w\\._\\(\\)]+$/",
        "AzKv_ConstructorFailed": "Azure key vault parameters initialization failed. Error: %s.",
        "DownloadingSecretsUsing": "Downloading secrets using: %s.",
        "GetSecretsFailed": "Get secrets failed. Error: %s.",
        "NoSecretsFound": "No secrets found in: %s",
        "NumberOfSecretsFound": "Number of secrets found in %s: %s",
        "NumberOfEnabledSecretsFound": "Number of enabled and unexpired secrets found in %s: %s",
        "DownloadingSecretValue": "Downloading secret value for: %s.",
        "GetSecretValueFailed": "Get secret value failed for: %s. Error: %s.",
        "ConflictingVariableFound": "Variable with name %s is defined in both environment and key vault"
    }
}