{
  "id": "2d8a1d60-8ccd-11e7-a792-11ac56e9f553",
  "name": "PyPIPublisher",
  "friendlyName": "ms-resource:loc.friendlyName",
  "description": "ms-resource:loc.description",
  "author": "Microsoft Corporation",
  "helpMarkDown": "ms-resource:loc.helpMarkDown",
  "category": "Utility",
  "visibility": [
    "Build",
    "Release"
  ],
  "demands": [],
  "version": {
    "Major": 0,
    "Minor": 1,
    "Patch": 0
  },
  "minimumAgentVersion": "2.0.0",
  "instanceNameFormat": "ms-resource:loc.instanceNameFormat",
  "inputs": [
    {
      "name": "wd",
      "type": "filePath",
      "label": "ms-resource:loc.input.label.wd",
      "required": true,
      "helpMarkDown": "ms-resource:loc.input.help.wd"
    },
    {
      "name": "serviceEndpoint",
      "type": "connectedService:generic",
      "label": "ms-resource:loc.input.label.serviceEndpoint",
      "required": true,
      "helpMarkDown": "ms-resource:loc.input.help.serviceEndpoint"
    }
  ],
  "execution": {
    "Node": {
      "target": "publisher.js",
      "argumentFormat": ""
    }
  }
}