{
  "id": "a433f589-fce1-4460-9ee6-44a624aeb1fb",
  "name": "DownloadBuildArtifact",
  "friendlyName": "ms-resource:loc.friendlyName",
  "description": "ms-resource:loc.description",
  "helpMarkDown": "ms-resource:loc.helpMarkDown",
  "category": "Utility",
  "author": "Microsoft Corporation",
  "preview": true,
  "version": {
    "Major": 0,
    "Minor": 1,
    "Patch": 48
  },
  "demands": [],
  "inputs": [
    {
      "name": "buildId",
      "type": "pickList",
      "label": "ms-resource:loc.input.label.buildId",
      "required": false,
      "helpMarkDown": "ms-resource:loc.input.help.buildId",
      "defaultValue": "$(Build.BuildId)",
      "options": {
        "$(Build.BuildId)": "The current build"
      }
    },
    {
      "name": "artifactName",
      "type": "string",
      "label": "ms-resource:loc.input.label.artifactName",
      "defaultValue": "drop",
      "required": true,
      "helpMarkDown": "ms-resource:loc.input.help.artifactName"
    },
    {
      "name": "downloadPath",
      "type": "string",
      "label": "ms-resource:loc.input.label.downloadPath",
      "defaultValue": "$(System.ArtifactsDirectory)",
      "required": true,
      "helpMarkDown": "ms-resource:loc.input.help.downloadPath"
    }
  ],
  "dataSourceBindings": [],
  "instanceNameFormat": "ms-resource:loc.instanceNameFormat",
  "execution": {
    "Node": {
      "target": "main.js",
      "argumentFormat": ""
    }
  },
  "messages": {
    "FileContainerCredentialsNotFound": "ms-resource:loc.messages.FileContainerCredentialsNotFound",
    "FileContainerInvalidArtifact": "ms-resource:loc.messages.FileContainerInvalidArtifact",
    "FileContainerInvalidArtifactData": "ms-resource:loc.messages.FileContainerInvalidArtifactData",
    "ArtifactProviderNotFound": "ms-resource:loc.messages.ArtifactProviderNotFound",
    "DownloadError": "ms-resource:loc.messages.DownloadError",
    "DownloadingFile": "ms-resource:loc.messages.DownloadingFile",
    "InvalidBuildId": "ms-resource:loc.messages.InvalidBuildId"
  }
}